{
    "classes": {
        "extrinsic component of membrane": "GO_0019898", 
        "membrane": "GO_0016020", 
        "side of membrane": "GO_0098552"
    }, 
    "def": {
        "text": "The component of the %s consisting of gene products and protein complexes that are loosely bound to one of its surfaces, but not integrated into the hydrophobic region.", 
        "vars": [
            "membrane"
        ]
    }, 
    "equivalentTo": {
        "text": "'extrinsic component of membrane' and ('part of' some %s)", 
        "vars": [
            "membrane"
        ]
    }, 
    "name": {
        "text": "extrinsic component of %s", 
        "vars": [
            "membrane"
        ]
    }, 
    "pattern_name": "extrinsic_membrane_component", 
    "relations": {
        "part of": "BFO_0000050"
    }, 
    "vars": {
        "membrane": "'membrane' or 'side of membrane'"
    }
}