{
    "classes": {
        "anchored component of membrane": "GO_0031225", 
        "membrane": "GO_0016020", 
        "side of membrane": "GO_0098552"
    }, 
    "def": {
        "text": "The component of the %s consisting of the gene products that are tethered to the membrane only by a covalently attached anchor, such as a lipid group that is embedded in the membrane. Gene products with peptide sequences that are embedded in the membrane are excluded from this grouping.", 
        "vars": [
            "membrane"
        ]
    }, 
    "equivalentTo": {
        "text": "'anchored component of membrane' and ('part of' some %s)", 
        "vars": [
            "membrane"
        ]
    }, 
    "name": {
        "text": "anchored component of %s", 
        "vars": [
            "membrane"
        ]
    }, 
    "pattern_name": "anchored_membrane_component", 
    "relations": {
        "part of": "BFO_0000050"
    }, 
    "vars": {
        "membrane": "'membrane' or 'side of membrane'"
    }
}