{
    "classes": {
        "chemical entity": "CHEBI_24431", 
        "cytosol": "GO_0005829", 
        "extracellular region": "GO_0005576", 
        "macromolecular complex": "GO_0043234", 
        "plasma membrane": "GO_0005886", 
        "transport": "GO_0006810"
    }, 
    "def": {
        "text": "The directed movement of %s from outside of a cell, across the plasma membrane and into the cytoplasmic compartment.", 
        "vars": [
            "imported"
        ]
    }, 
    "equivalentTo": {
        "text": "'transport' and ('has target start location' some 'extracellular region') and ('has target end location' some 'cytosol') and ('results in transport across' some 'plasma membrane') and ('imports' some %s)", 
        "vars": [
            "imported"
        ]
    }, 
    "name": {
        "text": "%s import across plasma membrane", 
        "vars": [
            "imported"
        ]
    }, 
    "pattern_name": "import_across_plasma_membrane", 
    "relations": {
        "has target end location": "RO_0002339", 
        "has target start location": "RO_0002338", 
        "imports": "RO_0002340", 
        "results in transport across": "RO_0002342"
    }, 
    "vars": {
        "imported": "'chemical entity' or 'macromolecular complex'"
    }
}