{
    "classes": {
        "membrane-bounded organelle": "GO_0043227", 
        "whole membrane": "GO_0098805"
    }, 
    "def": {
        "text": "The lipid bilayer that forms the outer layer of a %s.", 
        "vars": [
            "organelle"
        ]
    }, 
    "equivalentTo": {
        "text": "'whole membrane' that ('bounding layer of' some %s)", 
        "vars": [
            "organelle"
        ]
    }, 
    "name": {
        "text": "%s membrane", 
        "vars": [
            "organelle"
        ]
    }, 
    "pattern_name": "bounding_membrane_of_organelle", 
    "relations": {
        "bounding layer of": "RO_0002007"
    }, 
    "vars": {
        "organelle": "'membrane-bounded organelle'"
    }
}