{
    "classes": {
        "cellular_component": "GO_0005575", 
        "chemical entity": "CHEBI_24431", 
        "macromolecular complex": "GO_0032991", 
        "membrane": "GO_0016020"
    }, 
    "def": {
        "text": "The directed import of some %s from %s, across the %s and into the %s.", 
        "vars": [
            "cargo", 
            "start", 
            "membrane", 
            "end"
        ]
    }, 
    "equivalentTo": {
        "text": "'transport' that and ('has target start location' some %s) and ('has target end location' some %s) and ('imports' some %s) and ('results in transport across' some %s)", 
        "vars": [
            "start", 
            "end", 
            "cargo", 
            "membrane"
        ]
    }, 
    "name": {
        "text": "%s import across %s", 
        "vars": [
            "cargo", 
            "membrane"
        ]
    }, 
    "pattern_name": "import_across_membrane", 
    "relations": {
        "has target end location": "RO_0002339", 
        "has target start location": "RO_0002338", 
        "imports": "RO_0002340", 
        "results in transport across": "RO_0002342", 
        "transports or maintains localization of": "RO_0002313"
    }, 
    "vars": {
        "cargo": "'chemical entity' or 'macromolecular complex'", 
        "end": "'cellular_compomnent'", 
        "membrane": "'membrane'", 
        "start": "'cellular_component'"
    }
}