{
    "classes": {
        "integral component of membrane": "GO_0016021", 
        "intrinsic component of membrane": "GO_0031224", 
        "membrane": "GO_0016020", 
        "side of membrane": "GO_0098552"
    }, 
    "def": {
        "text": "The component of the %s consisting of gene products and protein complexes that have some covalently attached part (e.g. peptide sequence or GPI anchor), which spans or is embedded in one or both leaflets the membrane.", 
        "vars": [
            "membrane"
        ]
    }, 
    "equivalentTo": {
        "text": "'integral component of membrane' and ('part of' some %s)", 
        "vars": [
            "membrane"
        ]
    }, 
    "name": {
        "text": "intrinsic component of %s", 
        "vars": [
            "membrane"
        ]
    }, 
    "pattern_name": "intrinsic_membrane_component", 
    "relations": {
        "part of": "BFO_0000050"
    }, 
    "subClassOf": {
        "text": "'part of' some ('intrinsic component of membrane' and 'part of' some %s)", 
        "vars": [
            "membrane"
        ]
    }, 
    "vars": {
        "membrane": "'membrane' or 'side of membrane'"
    }
}